Product code;Price;Product name
"CRV-0308";"2799.72";"Комод Rattan Style, 42 л  (темно-коричневый) [06604-210]"
"ATB-0057";"129.99";"Вешалка для костюма с клипсами (оранжевая) [AHS121]"
"ATB-0058";"129.99";"Вешалка для костюма с клипсами (синяя) [AHS131]"
"ATB-0059";"89.99";"Вешалка для юбок (оранжевая) [AHS821]"
"ATB-0060";"89.99";"Вешалка для юбок (синяя) [AHS831]"
"ATB-0061";"109.99";"Вешалка широкая с перекладиной и крючками (оранжевая) [AHS581]"
"ATB-0062";"109.99";"Вешалка широкая с перекладиной и крючками (синяя) [AHS591]"
"ATB-0063";"109.99";"Вешалка с широкими плечиками (оранжевая) [AHS541]"
"ATB-0064";"109.99";"Вешалка с широкими плечиками (синяя) [AHS551]"
"ATB-0065";"129.99";"Набор детских вешалок (2 шт.) [AHC882]"
"ATB-0066";"349.97";"Набор детских вешалок, 35 см (4шт.) [AHC874]"
"ATB-0067";"0.00";"Набор вешалок  (снято с производства) [AHS817]"
"ATB-0068";"0.00";"Набор вешалок (снято с производства) [AHS717]"
"ATB-0069";"159.98";"Набор вешалок для брюк с клипсами оранжевые (3 шт.) [AHS353]"
"ATB-0070";"159.98";"Набор вешалок для брюк с клипсами синие (3 шт.) [AHS363]"
"ATB-0071";"429.96";"Набор вешалок с перекладиной оранжевые (5 шт.) [AHS105]"
"ATB-0072";"429.96";"Набор вешалок с перекладиной синие (5 шт.) [AHS115]"
"ATB-0073";"569.94";"Набор изогнутых вешалок с антискользящей перекладиной (6 шт.) [AHN106]"
"ATB-0074";"569.94";"Набор изогнутых вешалок с антискользящей перекладиной (6 шт.) [AHR106]"
"ATB-0075";"0.00";"Набор изогнутых вешалок с перекладиной (снято с производства) [AHN126]"
"ATB-0076";"449.96";"Набор прямых вешалок из красного дерева (6 шт.)  [AHR196]"
"ATB-0077";"479.95";"Набор прямых вешалок (6 шт.) [AHN196]"
"ATB-0078";"579.94";"Набор прямых вешалок с антискользящей перекладиной (6 шт.) [AHR116]"
"ATB-0079";"549.95";"Набор прямых вешалок с антискользящей перекладиной (6 шт.) [AHN116]"
"ATB-0080";"369.96";"Набор бамбуковых вешалок с антискользящей перекладиной (3 шт.) [AHB103]"
"TRM-0001";"3375.66";"Термос из коррозионностойкой стали Rocket Bottle 1.8L (Чёрный - NCB-18B) [835666]"
"TRM-0002";"4199.58";"Термос из коррозионностойкой стали Rocket Bottle 1.8L (Чёрный - NCB-18B) [835680]"
"TRM-0003";"2499.75";"Термос из коррозионностойкой стали 1L (Красный - FBB-1000BC) [851994]"
"TRM-0004";"1849.82";"Термос из коррозионностойкой стали 0.5L (Красный - FBB-500BC) [852984]"
"TRM-0005";"1849.82";"Термос из коррозионностойкой стали 0.5L (Голубой - FBB-500BC) [836054]"
"TRM-0006";"2849.72";"Термос из коррозионностойкой стали 1.0L (Гусь - FBB-1000) [851936]"
"ATB-0035";"159.98";"Вешалка изогнутая с антискользящей перекладиной (красное дерево) [AHR101]"
"ATB-0036";"179.98";"Вешалка изогнутая с антискользящей перекладиной [AHN101]"
"ATB-0037";"219.98";"Вешалка бамбуковая прямая с антискользящей перекладиной [AHB191]"
"ATB-0038";"149.99";"Вешалка прямая с антискользящей перекладиной (красное дерево) [AHR111]"
"ATB-0039";"149.99";"Вешалка прямая с антискользящей перекладиной [AHN111]"
"ATB-0040";"119.99";"Вешалка прямая (красное дерево) [AHR191]"
"ATB-0041";"119.99";"Вешалка прямая [AHN191]"
"ATB-0042";"149.99";"Вешалка бамбуковая прямая [AHB101]"
"ATB-0043";"119.99";"Вешалка с перекладиной зеленая [AHM833]"
"ATB-0044";"119.99";"Вешалка с перекладиной красная [AHM823]"
"ATB-0045";"119.99";"Вешалка с перекладиной черная [AHM813]"
"ATB-0046";"289.97";"Вешалка бамбуковая с широкими плечиками [AHB511]"
"ATB-0047";"119.99";"Вешалка с широкими плечиками зеленая [AHM531]"
"ATB-0048";"119.99";"Вешалка с широкими плечиками красная [AHM521]"
"ATB-0049";"309.97";"Вешалка широкая для верхней одежды с клипсами, 44 см [AHD551]"
"ATB-0050";"289.97";"Вешалка широкая для верхней одежды с клипсами, 44 см [AHO551]"
"ATB-0051";"69.99";"Вешалка для брюк с клипсами (оранжевая) [AHS351]"
"ATB-0052";"69.99";"Вешалка для брюк с клипсами (синяя) [AHS361]"
"ATB-0053";"119.99";"Вешалка для брюк (оранжевая) [AHS381]"
"ATB-0054";"119.99";"Вешалка для брюк (синяя) [AHS391]"
"ATB-0055";"99.99";"Вешалка для галстуков (оранжевая) [AHS801]"
"ATB-0056";"109.99";"Вешалка для галстуков (синяя) [AHS811]"
"LMN-0001";"359.96";"Контейнер стеклянный Keep'n'Box квадратный, 1,17 л [G8400]"
"LMN-0002";"199.98";"Контейнер стеклянный Keep'n'Box квадратный, 0,36 л [G8398]"
"LMN-0003";"309.97";"Контейнер стеклянный Keep'n'Box квадратный, 0,72 л [G8413]"
"ATB-0024";"209.98";"Вешалка для костюма [AHN151]"
"ATB-0023";"219.98";"Вешалка для костюма (красное дерево) [AHR151]"
"ATB-0022";"109.99";"Вешалка для галстуков черная [AHM611]"
"ATB-0021";"329.97";"Вешалка для галстуков [AHN811]"
"PMB-0042";"219.98";"Ведро с носиком, 12 л. [C278]"
"ATB-0020";"109.99";"Вешалка для галстуков красный [AHM621]"
"ATB-0010";"119.99";"Вешалка для брюк с текстильной прокладкой (красное дерево) [AHR301]"
"ATB-0004";"139.99";"Вешалка для брюк бамбуковая с текстильной прокладкой [AHB301]"
"ATB-0003";"89.99";"Вешалка для брюк с клипсами черная [AHM311]"
"CRV-0175";"379.96";"Ящик для хранения Stockholm Romance, 6 л [04710-D64]"
"CRV-0174";"0.00";"Ящик для хранения Stockholm Photo, 6 л [04710-D52]"
"ATB-0033";"139.99";"Вешалка для юбок (красное дерево) [AHR851]"
"CRV-0172";"0.00";"Ящик для хранения Stockholm Mediteranean, 6 л [04710-D68]"
"CRV-0171";"0.00";"Ящик для хранения Stockholm Media, 6 л [04710-D54]"
"CRV-0170";"379.96";"Ящик для хранения Stockholm Leather, 6 л [04710-D12]"
"CRV-0169";"0.00";"Ящик для хранения Stockholm Labyrinth, 6 л [04710-D51]"
"CRV-0168";"379.96";"Ящик для хранения Stockholm Japanese Brush, 6 л [04710-D20]"
"CRV-0167";"379.96";"Ящик для хранения Stockholm Classico, 6 л [04710-D41]"
"CRV-0166";"379.96";"Ящик для хранения Stockholm Chaos, 6 л [04710-D65]"
"CRV-0165";"379.96";"Ящик для хранения Stockholm Black Lily, 6 л [04710-D66]"
"CRV-0164";"379.96";"Ящик для хранения Stockholm Bamboo, 6 л [04710-D67]"
"CRV-0163";"0.00";"Ящик для хранения Stockholm Accessories, 6 л [04710-D53]"
"CRV-0305";"699.93";"Ящик для хранения Stockholm Paris, 22 л [04711-P35]"
"CRV-0286";"0.00";"Ящик для хранения Madrid Disney Cars, 20 л (снято с произв.) [04704-D21]"
"CRV-0162";"699.93";"Ящик для хранения Stockholm Balls, 22 л [04711-F07]"
"CRV-0161";"699.93";"Ящик для хранения Stockholm Football Player, 22 л [04711-F06]"
"OKT-0008";"649.94";"Ящик для хранения Hot Wheels, 10 л. [OKT2705]"
"CRV-0158";"649.94";"Ящик для хранения Stockholm Color Pink, 22 л [04711-325]"
"CRV-0157";"649.94";"Ящик для хранения Stockholm Color Blue, 22 л [04711-084]"
"CRV-0156";"649.94";"Ящик для хранения Stockholm Color Green, 22 л [04711-512]"
"CRV-0155";"649.94";"Ящик для хранения Stockholm Color Orange, 22 л [04711-250]"
"CRV-0220";"2109.79";"Туристический холодильник, 20 л [06720]"
"CRV-0221";"289.97";"Охлаждающий элемент для туристического холодильника, 2 шт [00112]"
"OKT-0003";"749.93";"Ящик для хранения Barbie, 20 л. [OKT2806]"
"CRV-0150";"699.93";"Ящик для хранения Stockholm Old Wood, 22 л [04711-D08]"
"ATB-0032";"139.99";"Вешалка для юбок с плечиками [AHN841]"
"CRV-0148";"699.93";"Ящик для хранения Stockholm Romance, 22 л [04711-D64]"
"CRV-0147";"0.00";"Ящик для хранения Stockholm Photo, 22 л [04711-D52]"
"CRV-0173";"0.00";"Ящик для хранения Stockholm Outerspace, 6 л [04710-D70]"
"CRV-0149";"0.00";"Ящик для хранения Stockholm Sugarpop, 22 л [04711-D69]"
"CRV-0144";"0.00";"Ящик для хранения Stockholm Media, 22 л [04711-D54]"
"CRV-0143";"699.93";"Ящик для хранения Stockholm Leather, 22 л [04711-D12]"
"CRV-0142";"699.93";"Ящик для хранения Stockholm Japanese Brush, 22 л [04711-D20]"
"CRV-0145";"0.00";"Ящик для хранения Stockholm Mediteranean, 22 л [04711-D68]"
"CRV-0140";"0.00";"Ящик для хранения Stockholm Collections, 22 л [04711-D55]"
"CRV-0139";"699.93";"Ящик для хранения Stockholm Classico, 22 л [04711-D41]"
"CRV-0146";"0.00";"Ящик для хранения Stockholm Outerspace, 22 л [04711-D70]"
"CRV-0137";"699.93";"Ящик для хранения Stockholm Black Lily, 22 л [04711-D66]"
"CRV-0306";"699.93";"Ящик для хранения Stockholm Cow, 22 л [04711-C11]"
"CRV-0135";"699.93";"Ящик для хранения Stockholm British Flag, 22 л [04711-D99]"
"CRV-0133";"249.98";"Контейнер для хранения, 5,7 л [03003]"
"CRV-0132";"399.96";"Контейнер для хранения, 18,5 л [03002]"
"CRV-0131";"729.93";"Контейнер для хранения Keeper, 30 л [02148]"
"CRV-0130";"399.96";"Контейнер для хранения Keeper, 10 л [02147]"
"CRV-0281";"379.96";"Ящик для хранения Stockholm Balls, 6 л [04710-F07]"
"CRV-0288";"0.00";"Ящик для хранения Madrid Disney Princess, 20 л (снято с произв.) [04704-D33]"
"CRV-0287";"0.00";"Ящик для хранения Madrid Disney Winnie-the-Pooh, 20 л (снято с произв.) [04704-D58]"
"PMB-0043";"339.97";"Этажерка угловая 3-секционная [C087]"
"CRV-0129";"599.94";"Контейнер для хранения, 33 л [03000]"
"CRV-0075";"129.99";"Корзина пластиковая ""Альфа"" 1, 31х18х11 см [15164]"
"CRV-0076";"229.98";"Корзина пластиковая ""Альфа"" 2, 35х25х16 см [15165]"
"CRV-0077";"269.97";"Корзина пластиковая ""Альфа"" 3, 41х30х16 см [15166]"
"CRV-0078";"399.96";"Корзина пластиковая ""Альфа"" 4, 43х31х26 см [15167]"
"CRV-0079";"809.92";"Корзина для белья, 45 л [00819]"
"CRV-0081";"899.91";"Корзина для белья Econom, 60 л (кремовая) [00820-058]"
"CRV-0082";"729.93";"Корзина для белья Standart, 60 л [05017]"
"CRV-0083";"999.90";"Корзина для белья Rattan Style, 40 л (коричневая) [00709-213]"
"CRV-0084";"999.90";"Корзина для белья Rattan Style, 40 л (темно-коричневая) [00709-210]"
"CRV-0085";"999.90";"Корзина для белья Rattan Style, 40 л (темно-серая) [00709-308]"
"CRV-0086";"999.90";"Корзина для белья Rattan Style, 40 л (кремовая) [00709-885]"
"CRV-0087";"1199.88";"Корзина для белья Rattan Style, 60 л (коричневая) [00707-213]"
"CRV-0088";"1199.88";"Корзина для белья Rattan Style, 60 л (темно-коричневая) [00707-210]"
"CRV-0089";"1199.88";"Корзина для белья Rattan Style, 60 л (темно-серая) [00707-308]"
"CRV-0090";"1199.88";"Корзина для белья Rattan Style, 60 л (кремовая) [00707-885]"
"CRV-0091";"1099.89";"Корзина для белья Rattan Style круглая, 48 л (темно-коричневая) [00710-210]"
"CRV-0092";"1099.89";"Корзина для белья Rattan Style круглая, 48 л (кремовая) [00710-885]"
"CRV-0093";"709.93";"Корзина для глаженого белья Rattan Style, 45 л (кремовая) [00708-885]"
"CRV-0094";"709.93";"Корзина для глаженого белья Rattan Style, 45 л (коричневая) [00708-213]"
"CRV-0095";"709.93";"Корзина для глаженого белья Rattan Style, 45 л (темно-коричневая) [00708-210]"
"CRV-0096";"709.93";"Корзина для глаженого белья Rattan Style, 45 л (темно-серая) [00708-308]"
"CRV-0097";"719.93";"Корзина Rattan Style L с крышкой (кремовая) [03619-885]"
"CRV-0098";"719.93";"Корзина Rattan Style L с крышкой (коричневая) [03619-213]"
"CRV-0099";"719.93";"Корзина Rattan Style L с крышкой (темно-коричневая) [03619-210]"
"CRV-0100";"719.93";"Корзина Rattan Style L с крышкой (темно-серая) [03619-308]"
"CRV-0101";"629.94";"Корзина Rattan Style L (коричневая) [03616-213]"
"CRV-0102";"629.94";"Корзина Rattan Style L (кремовая) [03616-885]"
"CRV-0103";"629.94";"Корзина Rattan Style L (темно-коричневая) [03616-210]"
"CRV-0104";"629.94";"Корзина Rattan Style L (темно-серая) [03616-308]"
"CRV-0105";"419.96";"Корзина Rattan Style M (темно-серая) [03615-308]"
"CRV-0106";"419.96";"Корзина Rattan Style M (коричневая) [03615-213]"
"CRV-0107";"419.96";"Корзина Rattan Style M (темно-коричневая) [03615-210]"
"CRV-0108";"419.96";"Корзина Rattan Style M (кремовая) [03615-885]"
"CRV-0109";"249.98";"Корзина Rattan Style S (коричневая) [03614-213]"
"CRV-0110";"249.98";"Корзина Rattan Style S (темно-коричневая) [03614-210]"
"CRV-0111";"249.98";"Корзина Rattan Style S (кремовая) [03614-885]"
"CRV-0112";"249.98";"Корзина Rattan Style S (темно-серая) [03614-308]"
"CRV-0113";"249.98";"Корзина для хранения My Style S, 8 л. (прозрачная) [03610-001]"
"CRV-0114";"249.98";"Корзина для хранения My Style S, 8 л. (серая) [03610-087]"
"CRV-0115";"249.98";"Корзина для хранения My Style S, 8 л. (т.коричневая) [03610-210]"
"CRV-0116";"249.98";"Корзина для хранения My Style S, 8 л. (кремовая) [03610-885]"
"CRV-0117";"349.97";"Корзина для хранения My Style M, 13 л. (прозрачная) [03611-001]"
"CRV-0118";"349.97";"Корзина для хранения My Style M, 13 л. (серая) [03611-087]"
"CRV-0119";"349.97";"Корзина для хранения My Style M, 13 л. (т.коричневая) [03611-210]"
"CRV-0120";"349.97";"Корзина для хранения My Style M, 13 л. (кремовая) [03611-885]"
"CRV-0121";"429.96";"Корзина для хранения My Style L, 18 л. (прозрачная) [03612-001]"
"CRV-0122";"429.96";"Корзина для хранения My Style L, 18 л. (серая) [03612-087]"
"CRV-0123";"429.96";"Корзина для хранения My Style L, 18 л. (т.коричневая) [03612-210]"
"CRV-0124";"429.96";"Корзина для хранения My Style L, 18 л. (кремовая) [03612-885]"
"CRV-0125";"529.95";"Корзина для хранения My Style Square, 25 л. (прозрачная) [03613-001]"
"CRV-0126";"529.95";"Корзина для хранения My Style Square, 25 л. (серая) [03613-087]"
"CRV-0127";"529.95";"Корзина для хранения My Style Square, 25 л. (т.коричневая) [03613-210]"
"CRV-0128";"529.95";"Корзина для хранения My Style Square, 25 л. (кремовая) [03613-885]"
"PMB-0044";"409.96";"Этажерка угловая 4-секционная [C088]"
"CRV-0307";"1599.84";"Подкроватный ящик Rattan Style на колесах, 42 л  (кремовый) [01704-885]"
"CRV-0074";"1699.83";"Контейнер хозяйственный, 90 л [2974]"
"CRV-0073";"539.95";"Ящик для инструментов Cars, 13 л [02898-C01]"
"CRV-0071";"1999.80";"Ящик для мастерской, 46х19х39 см [02910-1]"
"CRV-0070";"2399.76";"Ящик для мастерской, 42х29х36 см [02903]"
"CRV-0069";"0.00";"Ящик для мастерской [02924]"
"CRV-0068";"2199.78";"Ящик для инструментов Premium [02935]"
"CRV-0067";"0.00";"Ящик для инструментов [07714]"
"CRV-0066";"1599.84";"Ящик для инструментов Premium [02934]"
"CRV-0065";"1040.30";"Ящик для инструментов Premium [02925]"
"CRV-0064";"539.95";"Ящик для инструментов Basics [02901]"
"CRV-0063";"0.00";"Ящик для инструментов [07711]"
"CRV-0062";"249.98";"Ящик для инструментов Basics [02900]"
"CRV-0061";"799.92";"Ящик для инструментов [02956]"
"CRV-0060";"259.97";"Футляр для мелочей Curver 2 [07746]"
"CRV-0059";"419.96";"Футляр для мелочей Curver 3 [07747]"
"CRV-0058";"289.97";"Футляр для мелочей Curver 1 [02921]"
"CRV-0057";"299.97";"Набор квадратных контейнеров Take Away, 5 предметов [08323]"
"CRV-0056";"319.97";"Набор квадратных контейнеров Take Away, 5 предметов [08313]"
"CRV-0055";"299.97";"Набор прямоугольных контейнеров Take Away, 4 предмета [08324]"
"CRV-0054";"209.98";"Набор квадратных контейнеров Take Away, 3 предмета [08323-2]"
"CRV-0053";"239.98";"Набор прямоугольных контейнеров Take Away, 3 предмета [08324-2]"
"CRV-0052";"199.98";"Набор квадратных контейнеров Take Away, 3 предмета [08313-2]"
"CRV-0051";"219.98";"Набор квадратных контейнеров Fresh&Go, 3 предмета [08560-007]"
"CRV-0050";"219.98";"Набор квадратных контейнеров Fresh&Go, 3 предмета [08560-139]"
"CRV-0049";"219.98";"Набор квадратных контейнеров Fresh&Go, 3 предмета [08559-007]"
"CRV-0048";"219.98";"Набор квадратных контейнеров Fresh&Go, 3 предмета [08559-139]"
"CRV-0047";"339.97";"Набор квадратных контейнеров Fresh&Go, 4 предмета [08927-007]"
"CRV-0041";"149.99";"Контейнер Fresh&Go прямоугольный, 2 л [00555-007]"
"CRV-0042";"149.99";"Контейнер Fresh&Go прямоугольный, 3 л [00556-139]"
"CRV-0043";"149.99";"Контейнер Fresh&Go прямоугольный, 3 л [00556-007]"
"CRV-0044";"279.97";"Набор квадратных контейнеров Fresh&Go, 3 предмета [08924-139]"
"CRV-0045";"279.97";"Набор квадратных контейнеров Fresh&Go, 3 предмета [08924-007]"
"CRV-0046";"339.97";"Набор квадратных контейнеров Fresh&Go, 4 предмета [08927-139]"
"PMB-0024";"329.97";"Контейнер детский ""Радуга"", 15 л. [C81101]"
"ATB-0018";"0.00";"Вешалка для галстуков и платков (снято с производства) [AHN821]"
"ATB-0017";"379.96";"Вешалка для верхней одежды с клипсами, 46,5 см [AHO541]"
"ATB-0015";"309.97";"Вешалка для верхней одежды с антискользящей перекладиной, 46,5 см [AHO521]"
"ATB-0016";"419.96";"Вешалка для верхней одежды с клипсами, 46,5 см [AHD541]"
"PMB-0001";"159.98";"Набор вешалок для верхней одежды, размер 44-46 (5 шт.) [C204]"
"CRV-0234";"749.93";"Ведро для мусора Flip Bin, 25 л. (жёлтое) [02171-728]"
"CRV-0235";"749.93";"Ведро для мусора Flip Bin, 25 л. (серое) [02171-686]"
"CRV-0292";"699.93";"Ящик для хранения Stockholm London, 22 л [04711-L08]"
"PMB-0041";"169.98";"Ведро ""Люкс"", 9 л. [C141]"
"PMB-0040";"179.98";"Ведро ""Люкс"", 13 л. [C144]"
"PMB-0039";"159.98";"Ведро, 7 л. [C079]"
"PMB-0038";"109.99";"Ведро, 5 л. [C139]"
"PMB-0037";"89.99";"Ведро, 3 л. [C140]"
"PMB-0036";"189.98";"Ведро, 15 л. [C056]"
"CRV-0206";"0.00";"Контейнер PetLife для корма, 1,2 л. [00014-P79]"
"PMB-0035";"169.98";"Ведро, 12 л. [C074]"
"CRV-0252";"599.94";"Ведро для мусора ""Тигренок"", 12 л. [07123]"
"CRV-0251";"549.95";"Ведро для мусора ""Поросенок"", 12 л. [07121]"
"PMB-0045";"749.93";"Этажерка для обуви  [C406]"
"CRV-0250";"499.95";"Ведро для мусора Dominik, 25 л. [05322]"
"PMB-0023";"229.98";"Контейнер детский ""Радуга"", 6,5 л. [C80901]"
"CRV-0249";"249.98";"Ведро для мусора Dominik, 10 л. [05312]"
"CRV-0248";"799.92";"Ведро для мусора Click-it, 25 л. [04044]"
"CRV-0247";"599.94";"Ведро для мусора Click-it, 15 л. [04043]"
"CRV-0246";"379.96";"Ведро для мусора Click-it, 9 л. [04042]"
"CRV-0245";"179.98";"Ведро для мусора Click-it, 1,5 л. [04041]"
"CRV-0242";"339.97";"Ведро для мусора Roll Top, 10 л. [03974]"
"CRV-0239";"949.91";"Ведро для мусора Flip Bin, 50 л. (серое) [02172-686]"
"CRV-0253";"999.90";"Стеллаж Disney Cars [00064-C01]"
"CRV-0254";"0.00";"Стеллаж Disney Винни-пух (СНЯТО С ПРОИЗВОДСТВА) [00064-D58]"
"CRV-0255";"0.00";"Стеллаж Disney Princess  (СНЯТО С ПРОИЗВОДСТВА) [00064-D33]"
"CRV-0040";"149.99";"Контейнер Fresh&Go прямоугольный, 2 л [00555-139]"
"CRV-0039";"169.98";"Контейнер Fresh&Go квадратный, 2,9 л [00562-007]"
"CRV-0038";"169.98";"Контейнер Fresh&Go квадратный, 2,9 л [00562-139]"
"CRV-0037";"109.99";"Контейнер Fresh&Go круглый, 1 л [00564-007]"
"CRV-0036";"109.99";"Контейнер Fresh&Go прямоугольный, 1 л [00554-139]"
"CRV-0035";"109.99";"Контейнер Fresh&Go круглый, 1 л [00564-139]"
"CRV-0034";"139.99";"Контейнер Fresh&Go квадратный, 1,7 л [00561-007]"
"CRV-0033";"139.99";"Контейнер Fresh&Go квадратный, 1,7 л [00561-139]"
"CRV-0032";"109.99";"Контейнер Fresh&Go квадратный, 1,2 л [00560-007]"
"CRV-0031";"109.99";"Контейнер Fresh&Go квадратный, 1,2 л [00560-139]"
"CRV-0030";"99.99";"Контейнер Fresh&Go квадратный, 0,8 л [00559-139]"
"CRV-0284";"3749.63";"Комод Disney Cars 4 ящика Х 10 л. [00066-C01]"
"CRV-0198";"79.99";"Миска для животных двойная [C663]"
"CRV-0199";"149.99";"Мультиснап PetLife Cats, 0,6 л [02275-P73]"
"CRV-0200";"149.99";"Мультиснап PetLife Dogs, 0,6 л [02275-P74]"
"CRV-0201";"169.98";"Мультиснап PetLife Cats, 0,9 л [02276-P73]"
"CRV-0202";"229.98";"Мультиснап PetLife, 2,7 л [02273-P75]"
"CRV-0203";"229.98";"Мультиснап PetLife Cats, 2,7 л [02273-P73]"
"CRV-0204";"229.98";"Мультиснап PetLife Dogs, 2,7 л [02273-P74]"
"CRV-0205";"0.00";"Контейнер PetLife для корма [00013-P79]"
"RGI-0108";"718.93";"Термокружка Gotto, 0,52 л [93-TE-GO-1-520.1]"
"RGI-0109";"718.93";"Термокружка Gotto, 0,52 л [93-TE-GO-1-520.2]"
"RGI-0110";"718.93";"Термокружка Gotto, 0,52 л [93-TE-GO-1-520.3]"
"RGI-0111";"603.94";"Термокружка Gotto, 0,5 л [93-TE-GO-2-500]"
"RGI-0101";"939.91";"Термос ланч-бокс Soup на 2 лотка, 1 л [93-TE-S-3-1000V]"
"RGI-0100";"1159.88";"Термос ланч-бокс Soup на 3 лотка, 1,5 л [93-TE-S-3-1500T]"
"RGI-0099";"939.91";"Термос ланч-бокс Soup на 2 лотка, 1 л [93-TE-S-3-1000T]"
"RGI-0096";"641.94";"Термос Soup с широким горлом, 0,38 л [93-TE-S-1-380]"
"RGI-0097";"661.93";"Термос Soup с широким горлом, 0,48 л [93-TE-S-1-480]"
